{
  "schemaVersion": "1.0",
  "snapshotDate": "2026-08-13",
  "program": {
    "name": "Obserra Website and Academy CMMC Level 2 Traceability",
    "owner": "OBSERRA EXECUTIVE PROTECTION & INTELLIGENCE LLC",
    "repository": "jblan2026-hub/obserra-website",
    "branch": "codex/production-readiness-cmmc-dual-baseline",
    "sourceCheckpoint": "ffb08fb2e9cb9033d9a3faf68c653e90c28a7b88",
    "claimBoundary": "Engineering alignment, evidence traceability, and audit readiness only. This register does not claim CMMC certification, a CMMC status in SPRS, FedRAMP authorization, FDACS approval, or authorization to process CUI."
  },
  "framework": {
    "engineeringBaseline": {
      "publication": "NIST SP 800-171 Rev. 3",
      "assessmentPublication": "NIST SP 800-171A Rev. 3",
      "activeRequirementCount": 97
    },
    "cmmcLevel2CurrentRuleBaseline": {
      "publication": "NIST SP 800-171 Rev. 2",
      "requirementCount": 110,
      "ruleState": "As of 2026-08-13, CMMC Phase II implementation is suspended while Phase I self assessment requirements remain. Current DoD Level 2 enforcement continues to reference the 110 requirements in NIST SP 800-171 Rev. 2.",
      "crosswalkPurpose": "NIST SP 800-171 Rev. 3 is the Obserra engineering baseline. Rev. 2 practice mappings are retained so the evidence package remains usable for the currently enforced CMMC Level 2 assessment baseline."
    },
    "officialSources": [
      "https://csrc.nist.gov/pubs/sp/800/171/r3/final",
      "https://csrc.nist.gov/pubs/sp/800/171/a/r3/final",
      "https://csrc.nist.gov/projects/cprt/catalog",
      "https://dowcio.war.gov/CMMC/About/",
      "https://www.acquisition.gov/dfars/252.204-7021-contractor-compliance-cybersecurity-maturity-model-certification-level-requirements."
    ]
  },
  "traceability": {
    "singleSourceOfTruth": "docs/florida-class-d-lms/CMMC-LEVEL-2-REV3-TRACEABILITY.json",
    "schema": "docs/florida-class-d-lms/CMMC-LEVEL-2-REV3-TRACEABILITY.schema.json",
    "generator": "scripts/cmmc-level2-rev3-traceability.mjs",
    "humanReadable": "docs/florida-class-d-lms/CMMC-LEVEL-2-REV3-AUDIT-MATRIX.md",
    "digest": "docs/florida-class-d-lms/CMMC-LEVEL-2-REV3-TRACEABILITY.sha256",
    "ciCommand": "npm run verify:cmmc-traceability",
    "driftPolicy": "CI fails if the source register is invalid, the NIST Rev. 3 catalog is incomplete, a mapped requirement is unknown, evidence references are missing, the generated Markdown differs, or the recorded SHA-256 digest differs."
  },
  "scope": {
    "formalCuiAssessmentScopeEstablished": false,
    "sspComplete": false,
    "networkDiagramComplete": false,
    "assetInventoryComplete": false,
    "cuiProcessingAuthorized": false,
    "boundary": "Public website, Obserra Academy and LMS, supporting GitHub backend, Supabase Academy database and Edge Functions, Clerk identity, Stripe commerce, Vercel runtime, and direct dependencies required by those components.",
    "excluded": "Other Obserra applications and products not used by the website or Academy LMS workstream.",
    "assets": [
      {"asset": "GitHub repository and GitHub Actions", "provisionalCategory": "Security Protection Asset candidate", "evidenceState": "Source and CI evidence available."},
      {"asset": "Vercel obserra-website-live", "provisionalCategory": "CUI Asset or Security Protection Asset candidate depending future CUI use", "evidenceState": "Production runtime visible. Provider and failover evidence incomplete."},
      {"asset": "Supabase Obserra Academy", "provisionalCategory": "CUI Asset candidate if future CUI is stored, otherwise Security Protection or Contractor Risk Managed Asset candidate", "evidenceState": "Database controls inspectable. Backup and recovery evidence incomplete."},
      {"asset": "Clerk production identity", "provisionalCategory": "Security Protection Asset and external service provider candidate", "evidenceState": "Integration present. Post deployment identity validation and provider evidence pending."},
      {"asset": "Stripe production commerce", "provisionalCategory": "External service dependency not intended to receive CUI", "evidenceState": "Commerce health verified. Provider assurance evidence pending."},
      {"asset": "Daily media service", "provisionalCategory": "CUI Asset or Security Protection Asset candidate depending future information flow", "evidenceState": "Provider configuration and availability evidence pending."},
      {"asset": "Regulated Class D nonproduction Supabase branch", "provisionalCategory": "Contractor Risk Managed or test environment candidate", "evidenceState": "Synthetic nonproduction only. Production activation prohibited."}
    ]
  },
  "requirements": {
    "03.01": {
      "family": "Access Control",
      "defaultStatus": "partial_external_evidence_required",
      "items": [
        ["03.01.01", "Account Management"], ["03.01.02", "Access Enforcement"], ["03.01.03", "Information Flow Enforcement"], ["03.01.04", "Separation of Duties"], ["03.01.05", "Least Privilege"], ["03.01.06", "Least Privilege – Privileged Accounts"], ["03.01.07", "Least Privilege – Privileged Functions"], ["03.01.08", "Unsuccessful Logon Attempts"], ["03.01.09", "System Use Notification"], ["03.01.10", "Device Lock"], ["03.01.11", "Session Termination"], ["03.01.12", "Remote Access"], ["03.01.16", "Wireless Access"], ["03.01.18", "Access Control for Mobile Devices"], ["03.01.20", "Use of External Systems"], ["03.01.22", "Publicly Accessible Content"]
      ]
    },
    "03.02": {"family": "Awareness and Training", "defaultStatus": "organizational_evidence_required", "items": [["03.02.01", "Literacy Training and Awareness"], ["03.02.02", "Role-Based Training"]]},
    "03.03": {"family": "Audit and Accountability", "defaultStatus": "partial_external_evidence_required", "items": [["03.03.01", "Event Logging"], ["03.03.02", "Audit Record Content"], ["03.03.03", "Audit Record Generation"], ["03.03.04", "Response to Audit Logging Process Failures"], ["03.03.05", "Audit Record Review, Analysis, and Reporting"], ["03.03.06", "Audit Record Reduction and Report Generation"], ["03.03.07", "Time Stamps"], ["03.03.08", "Protection of Audit Information"]]},
    "03.04": {"family": "Configuration Management", "defaultStatus": "partial_external_evidence_required", "items": [["03.04.01", "Baseline Configuration"], ["03.04.02", "Configuration Settings"], ["03.04.03", "Configuration Change Control"], ["03.04.04", "Impact Analyses"], ["03.04.05", "Access Restrictions for Change"], ["03.04.06", "Least Functionality"], ["03.04.08", "Authorized Software – Allow by Exception"], ["03.04.10", "System Component Inventory"], ["03.04.11", "Information Location"], ["03.04.12", "System and Component Configuration for High-Risk Areas"]]},
    "03.05": {"family": "Identification and Authentication", "defaultStatus": "partial_external_evidence_required", "items": [["03.05.01", "User Identification and Authentication"], ["03.05.02", "Device Identification and Authentication"], ["03.05.03", "Multi-Factor Authentication"], ["03.05.04", "Replay-Resistant Authentication"], ["03.05.05", "Identifier Management"], ["03.05.07", "Password Management"], ["03.05.11", "Authentication Feedback"], ["03.05.12", "Authenticator Management"]]},
    "03.06": {"family": "Incident Response", "defaultStatus": "organizational_evidence_required", "items": [["03.06.01", "Incident Handling"], ["03.06.02", "Incident Monitoring, Reporting, and Response Assistance"], ["03.06.03", "Incident Response Testing"], ["03.06.04", "Incident Response Training"], ["03.06.05", "Incident Response Plan"]]},
    "03.07": {"family": "Maintenance", "defaultStatus": "organizational_evidence_required", "items": [["03.07.04", "Maintenance Tools"], ["03.07.05", "Nonlocal Maintenance"], ["03.07.06", "Maintenance Personnel"]]},
    "03.08": {"family": "Media Protection", "defaultStatus": "organizational_evidence_required", "items": [["03.08.01", "Media Storage"], ["03.08.02", "Media Access"], ["03.08.03", "Media Sanitization"], ["03.08.04", "Media Marking"], ["03.08.05", "Media Transport"], ["03.08.07", "Media Use"], ["03.08.09", "System Backup – Cryptographic Protection"]]},
    "03.09": {"family": "Personnel Security", "defaultStatus": "organizational_evidence_required", "items": [["03.09.01", "Personnel Screening"], ["03.09.02", "Personnel Termination and Transfer"]]},
    "03.10": {"family": "Physical Protection", "defaultStatus": "scope_dependent", "items": [["03.10.01", "Physical Access Authorizations"], ["03.10.02", "Monitoring Physical Access"], ["03.10.06", "Alternate Work Site"], ["03.10.07", "Physical Access Control"], ["03.10.08", "Access Control for Transmission"]]},
    "03.11": {"family": "Risk Assessment", "defaultStatus": "partial_external_evidence_required", "items": [["03.11.01", "Risk Assessment"], ["03.11.02", "Vulnerability Monitoring and Scanning"], ["03.11.04", "Risk Response"]]},
    "03.12": {"family": "Security Assessment and Monitoring", "defaultStatus": "partial_external_evidence_required", "items": [["03.12.01", "Security Assessment"], ["03.12.02", "Plan of Action and Milestones"], ["03.12.03", "Continuous Monitoring"], ["03.12.05", "Information Exchange"]]},
    "03.13": {"family": "System and Communications Protection", "defaultStatus": "partial_external_evidence_required", "items": [["03.13.01", "Boundary Protection"], ["03.13.04", "Information in Shared System Resources"], ["03.13.06", "Network Communications – Deny by Default – Allow by Exception"], ["03.13.08", "Transmission and Storage Confidentiality"], ["03.13.09", "Network Disconnect"], ["03.13.10", "Cryptographic Key Establishment and Management"], ["03.13.11", "Cryptographic Protection"], ["03.13.12", "Collaborative Computing Devices and Applications"], ["03.13.13", "Mobile Code"], ["03.13.15", "Session Authenticity"]]},